{
  "$schema": "./schema.json",
  "name": "Ink",
  "chainId": 57073,
  "stack": "op-stack",
  "gasModel": "op-stack",
  "cancun": null,
  "blockTimeSeconds": 1,
  "canonicalBridge": { "address": "0x0000000000000000000000000000000000000000", "_verify": true, "_note": "L1 StandardBridge / portal — Phase 9 rebalancing only" },
  "constants": {
    "permit2": { "address": "0x000000000022D473030F116dDEE9F6B43aC78BA3", "_verify": true, "_note": "Permit2 is usually at this canonical address, but confirm it is actually deployed on Ink" },
    "multicall3": { "address": "0xcA11bde05977b3631167028862bE2a173976CA11", "_verify": true, "_note": "confirm Multicall3 is deployed on Ink" }
  },
  "predeploys": {
    "weth": { "address": "0x4200000000000000000000000000000000000006", "_verify": false, "_source": "OP Stack predeploy (WETH9)" },
    "gasPriceOracle": { "address": "0x420000000000000000000000000000000000000F", "_verify": false, "_source": "OP Stack predeploy (GasPriceOracle)" },
    "l1Block": { "address": "0x4200000000000000000000000000000000000015", "_verify": false, "_source": "OP Stack predeploy (L1Block)" }
  },
  "flashProviders": {
    "aaveV3": { "available": null, "pool": { "address": "0x0000000000000000000000000000000000000000", "_verify": true }, "_note": "Aave V3 may NOT be on Ink (newer chain) — verify; likely absent" },
    "balancerV2": { "available": null, "vault": { "address": "0xBA12222222228d8Ba445958a75a0704d566BF2C8", "_verify": true }, "_note": "verify whether Balancer V2 is deployed on Ink; may be absent" },
    "uniswapV3Flash": { "available": null, "_note": "uses dexes.uniswapV3 if present" },
    "uniswapV4Flash": { "available": null, "_note": "uses dexes.uniswapV4 if present" }
  },
  "dexes": {
    "primaryDex": { "family": "unknown", "available": null, "router": { "address": "0x0000000000000000000000000000000000000000", "_verify": true }, "factory": { "address": "0x0000000000000000000000000000000000000000", "_verify": true }, "_note": "Ink is a newer chain — ENUMERATE the live DEXes (e.g. native/Velodrome-style forks, any Uniswap deployment) and add one entry per DEX with its verified family + addresses before writing adapters (task P1-T5)." }
  },
  "tokens": {
    "WETH": { "address": "0x4200000000000000000000000000000000000006", "decimals": 18, "_verify": false, "_source": "OP Stack predeploy WETH9" },
    "USDC": { "address": "0x0000000000000000000000000000000000000000", "decimals": 6, "_verify": true, "_note": "verify canonical/bridged USDC on Ink; confirm native vs bridged and decimals" },
    "USDT": { "address": "0x0000000000000000000000000000000000000000", "decimals": 6, "_verify": true }
  },
  "_sources": {
    "note": "Ink is a newer L2 — treat the whole provider/DEX/token set as unverified. Confirm each against official Ink docs + explorer before use. Do not invent addresses."
  }
}
