{
  "$schema": "./schema.json",
  "name": "Optimism",
  "chainId": 10,
  "stack": "op-stack",
  "gasModel": "op-stack",
  "cancun": null,
  "blockTimeSeconds": 2,
  "canonicalBridge": { "address": "0x0000000000000000000000000000000000000000", "_verify": true, "_note": "L1 StandardBridge / portal — needed only for cross-chain rebalancing (Phase 9)" },
  "constants": {
    "permit2": { "address": "0x000000000022D473030F116dDEE9F6B43aC78BA3", "_verify": false, "_source": "Uniswap Permit2 canonical deployment (identical on all chains)" },
    "multicall3": { "address": "0xcA11bde05977b3631167028862bE2a173976CA11", "_verify": false, "_source": "Multicall3 canonical deployment (identical on most chains)" }
  },
  "predeploys": {
    "weth": { "address": "0x4200000000000000000000000000000000000006", "_verify": false, "_source": "OP Stack predeploy (WETH9)" },
    "gasPriceOracle": { "address": "0x420000000000000000000000000000000000000F", "_verify": false, "_source": "OP Stack predeploy (GasPriceOracle)" },
    "l1Block": { "address": "0x4200000000000000000000000000000000000015", "_verify": false, "_source": "OP Stack predeploy (L1Block)" }
  },
  "flashProviders": {
    "aaveV3": { "available": null, "pool": { "address": "0x0000000000000000000000000000000000000000", "_verify": true }, "_note": "Aave V3 Pool — verify address & deployment on Optimism" },
    "balancerV2": { "available": null, "vault": { "address": "0xBA12222222228d8Ba445958a75a0704d566BF2C8", "_verify": false, "_source": "Balancer V2 Vault canonical (constant where deployed)" }, "_note": "confirm Balancer V2 is live on Optimism (address is constant if so)" },
    "uniswapV3Flash": { "available": null, "_note": "any Uniswap V3 pool supports flash; uses dexes.uniswapV3" },
    "uniswapV4Flash": { "available": null, "_note": "PoolManager flash-accounting; uses dexes.uniswapV4" }
  },
  "dexes": {
    "uniswapV3": { "family": "uniswap-v3", "available": null, "factory": { "address": "0x0000000000000000000000000000000000000000", "_verify": true }, "swapRouter": { "address": "0x0000000000000000000000000000000000000000", "_verify": true }, "quoterV2": { "address": "0x0000000000000000000000000000000000000000", "_verify": true }, "feeTiers": [100, 500, 3000, 10000] },
    "uniswapV4": { "family": "uniswap-v4", "available": null, "poolManager": { "address": "0x0000000000000000000000000000000000000000", "_verify": true }, "universalRouter": { "address": "0x0000000000000000000000000000000000000000", "_verify": true } },
    "velodrome": { "family": "solidly-v2+cl", "available": null, "router": { "address": "0x0000000000000000000000000000000000000000", "_verify": true }, "factory": { "address": "0x0000000000000000000000000000000000000000", "_verify": true }, "_note": "Velodrome vAMM/sAMM (v2) + Slipstream (CL). Verify both factories." }
  },
  "tokens": {
    "WETH": { "address": "0x4200000000000000000000000000000000000006", "decimals": 18, "_verify": false, "_source": "OP Stack predeploy WETH9" },
    "USDC": { "address": "0x0000000000000000000000000000000000000000", "decimals": 6, "_verify": true, "_note": "native USDC (Circle) — verify" },
    "USDT": { "address": "0x0000000000000000000000000000000000000000", "decimals": 6, "_verify": true },
    "DAI": { "address": "0x0000000000000000000000000000000000000000", "decimals": 18, "_verify": true }
  },
  "_sources": {
    "note": "Replace every _verify:true entry with a confirmed address + _source (see config/chains/README.md). Do not invent addresses."
  }
}
